{
  "axis_values": {
    "application_family": [
      "frustrated-loop",
      "portfolio"
    ],
    "calibration_status": [
      "not_applicable"
    ],
    "decision_difficulty": [
      "easy",
      "hard"
    ],
    "distribution_regime": [
      "iid",
      "ood"
    ],
    "embedding_difficulty": [
      "easy",
      "hard"
    ],
    "fault_status": [
      "faulted",
      "none"
    ],
    "host_family": [
      "replace-with-host-family-a",
      "replace-with-host-family-b"
    ],
    "problem_origin": [
      "application-derived",
      "synthetic"
    ],
    "sampling_difficulty": [
      "easy",
      "hard"
    ]
  },
  "corpus_design_version": "if-core-v2",
  "difficulty_calibration": {
    "authority": {
      "path": "strata/authority.json",
      "sha256": "aaaaaaaaaaaaaaaaaaaaaaaaaaaaaaaaaaaaaaaaaaaaaaaaaaaaaaaaaaaaaaaa"
    },
    "budget": {
      "path": "strata/budget.json",
      "sha256": "bbbbbbbbbbbbbbbbbbbbbbbbbbbbbbbbbbbbbbbbbbbbbbbbbbbbbbbbbbbbbbbb"
    },
    "evidence": {
      "path": "strata/evidence.json",
      "sha256": "cccccccccccccccccccccccccccccccccccccccccccccccccccccccccccccccc"
    },
    "origin": {
      "path": "strata/origin.json",
      "sha256": "ffffffffffffffffffffffffffffffffffffffffffffffffffffffffffffffff"
    },
    "outcome_blind": true,
    "panel": {
      "path": "strata/panel.json",
      "sha256": "dddddddddddddddddddddddddddddddddddddddddddddddddddddddddddddddd"
    },
    "protocol": {
      "path": "strata/protocol.json",
      "sha256": "eeeeeeeeeeeeeeeeeeeeeeeeeeeeeeeeeeeeeeeeeeeeeeeeeeeeeeeeeeeeeeee"
    },
    "publisher_id": "replace-with-publisher-id"
  },
  "independent_unit": "immutable-base-lineage",
  "lineage_registry": [
    {
      "application_family": "frustrated-loop",
      "base_lineage_key": "problem-sha256:1111111111111111111111111111111111111111111111111111111111111111",
      "calibration_sha256": null,
      "calibration_status": "not_applicable",
      "decision_difficulty": "easy",
      "distribution_regime": "iid",
      "embedding_difficulty": "easy",
      "fault_status": "none",
      "host_family": "replace-with-host-family-a",
      "learning_partition": "train",
      "problem_origin": "synthetic",
      "sampling_difficulty": "easy"
    },
    {
      "application_family": "portfolio",
      "base_lineage_key": "problem-sha256:2222222222222222222222222222222222222222222222222222222222222222",
      "calibration_sha256": null,
      "calibration_status": "not_applicable",
      "decision_difficulty": "hard",
      "distribution_regime": "iid",
      "embedding_difficulty": "hard",
      "fault_status": "faulted",
      "host_family": "replace-with-host-family-b",
      "learning_partition": "val",
      "problem_origin": "application-derived",
      "sampling_difficulty": "easy"
    },
    {
      "application_family": "frustrated-loop",
      "base_lineage_key": "problem-sha256:3333333333333333333333333333333333333333333333333333333333333333",
      "calibration_sha256": null,
      "calibration_status": "not_applicable",
      "decision_difficulty": "hard",
      "distribution_regime": "ood",
      "embedding_difficulty": "easy",
      "fault_status": "none",
      "host_family": "replace-with-host-family-a",
      "learning_partition": "test",
      "problem_origin": "synthetic",
      "sampling_difficulty": "hard"
    }
  ],
  "minimum_partition_base_lineages": {
    "test": 1546,
    "train": 1024,
    "val": 512
  },
  "partition_quotas": {
    "test": 1,
    "train": 1,
    "val": 1
  },
  "power_targets": [
    {
      "alpha": 0.05,
      "alternative": "one-sided-noninferiority",
      "assumed_discordance": 0.1,
      "assumed_true_difference": 0.0,
      "endpoint": "valid-return-noninferiority",
      "filter": {
        "application_family": [
          "frustrated-loop",
          "portfolio"
        ],
        "calibration_status": [
          "not_applicable"
        ],
        "decision_difficulty": [
          "easy",
          "hard"
        ],
        "distribution_regime": [
          "iid",
          "ood"
        ],
        "embedding_difficulty": [
          "easy",
          "hard"
        ],
        "fault_status": [
          "faulted",
          "none"
        ],
        "host_family": [
          "replace-with-host-family-a",
          "replace-with-host-family-b"
        ],
        "problem_origin": [
          "application-derived",
          "synthetic"
        ],
        "sampling_difficulty": [
          "easy",
          "hard"
        ]
      },
      "learning_partition": "test",
      "method": "paired-binary-normal-approximation",
      "minimum_base_lineages": 1546,
      "noninferiority_margin": 0.02,
      "power_separation": 0.02,
      "target_id": "test-valid-return-noninferiority",
      "target_power": 0.8
    },
    {
      "alpha": 0.05,
      "alternative": "one-sided-noninferiority",
      "assumed_discordance": 0.1,
      "assumed_true_difference": 0.05,
      "endpoint": "valid-return-noninferiority",
      "filter": {
        "application_family": [
          "portfolio"
        ],
        "calibration_status": [
          "not_applicable"
        ],
        "decision_difficulty": [
          "hard"
        ],
        "distribution_regime": [
          "iid"
        ],
        "embedding_difficulty": [
          "hard"
        ],
        "fault_status": [
          "faulted"
        ],
        "host_family": [
          "replace-with-host-family-b"
        ],
        "problem_origin": [
          "application-derived"
        ],
        "sampling_difficulty": [
          "easy"
        ]
      },
      "learning_partition": "val",
      "method": "paired-binary-normal-approximation",
      "minimum_base_lineages": 128,
      "noninferiority_margin": 0.02,
      "power_separation": 0.07,
      "target_id": "validation-valid-return-noninferiority",
      "target_power": 0.8
    }
  ],
  "precision_targets": [
    {
      "confidence_level": 0.95,
      "endpoint": "learned-minus-stock-unconditional-if-q3-s0",
      "filter": {
        "application_family": [
          "frustrated-loop",
          "portfolio"
        ],
        "calibration_status": [
          "not_applicable"
        ],
        "decision_difficulty": [
          "easy",
          "hard"
        ],
        "distribution_regime": [
          "iid",
          "ood"
        ],
        "embedding_difficulty": [
          "easy",
          "hard"
        ],
        "fault_status": [
          "faulted",
          "none"
        ],
        "host_family": [
          "replace-with-host-family-a",
          "replace-with-host-family-b"
        ],
        "problem_origin": [
          "application-derived",
          "synthetic"
        ],
        "sampling_difficulty": [
          "easy",
          "hard"
        ]
      },
      "half_width": 0.05,
      "learning_partition": "test",
      "method": "bounded-paired-difference-worst-case-normal",
      "minimum_base_lineages": 1537,
      "outcome_bounds": [
        -1.0,
        1.0
      ],
      "target_id": "test-learned-minus-stock-if-q3-s0-precision",
      "variance_bound": 1.0
    },
    {
      "confidence_level": 0.95,
      "endpoint": "learned-minus-stock-unconditional-if-q3-s0",
      "filter": {
        "application_family": [
          "portfolio"
        ],
        "calibration_status": [
          "not_applicable"
        ],
        "decision_difficulty": [
          "hard"
        ],
        "distribution_regime": [
          "iid"
        ],
        "embedding_difficulty": [
          "hard"
        ],
        "fault_status": [
          "faulted"
        ],
        "host_family": [
          "replace-with-host-family-b"
        ],
        "problem_origin": [
          "application-derived"
        ],
        "sampling_difficulty": [
          "easy"
        ]
      },
      "half_width": 0.2,
      "learning_partition": "val",
      "method": "bounded-paired-difference-worst-case-normal",
      "minimum_base_lineages": 128,
      "outcome_bounds": [
        -1.0,
        1.0
      ],
      "target_id": "validation-paired-utility-precision",
      "variance_bound": 1.0
    }
  ],
  "record_digest": "918141d2e147ca1d137f1721eb8b0c33bfef885d2a045a759b8b3cd9055bf274",
  "schema": "isingfold.corpus-design",
  "schema_version": 2,
  "stratum_quotas": [
    {
      "filter": {
        "application_family": [
          "frustrated-loop"
        ],
        "calibration_status": [
          "not_applicable"
        ],
        "decision_difficulty": [
          "easy"
        ],
        "distribution_regime": [
          "iid"
        ],
        "embedding_difficulty": [
          "easy"
        ],
        "fault_status": [
          "none"
        ],
        "host_family": [
          "replace-with-host-family-a"
        ],
        "problem_origin": [
          "synthetic"
        ],
        "sampling_difficulty": [
          "easy"
        ]
      },
      "learning_partition": "train",
      "minimum_base_lineages": 1,
      "quota_id": "quota-001-train"
    },
    {
      "filter": {
        "application_family": [
          "portfolio"
        ],
        "calibration_status": [
          "not_applicable"
        ],
        "decision_difficulty": [
          "hard"
        ],
        "distribution_regime": [
          "iid"
        ],
        "embedding_difficulty": [
          "hard"
        ],
        "fault_status": [
          "faulted"
        ],
        "host_family": [
          "replace-with-host-family-b"
        ],
        "problem_origin": [
          "application-derived"
        ],
        "sampling_difficulty": [
          "easy"
        ]
      },
      "learning_partition": "val",
      "minimum_base_lineages": 1,
      "quota_id": "quota-002-val"
    },
    {
      "filter": {
        "application_family": [
          "frustrated-loop"
        ],
        "calibration_status": [
          "not_applicable"